fname,spcode,seq,utter,stime,etime,splabel,key_phrase
2033_Julie_ Infection Control _Record No. UK-IC-01_AH_ W-TDI _UK_04102021 1415Hrs EST,B,187,But nothing has come across for her been told any feel for how long it would take to get a new product. And from the time it was first presented until the decision was made to to bring it in.,3038,3052,moderator,none
2033_Julie_ Infection Control _Record No. UK-IC-01_AH_ W-TDI _UK_04102021 1415Hrs EST,A,188,"I'm not too sure it takes a while because it has to go through quite a few meetings, committees like I think with something like this, I'll probably have to go through the device committee guidelines would have to be written about it. Trials would have to be done on it reports and all of that stuff.",3055,3077,respondent,none
2033_Julie_ Infection Control _Record No. UK-IC-01_AH_ W-TDI _UK_04102021 1415Hrs EST,B,189,So how would how would Infection Control evaluate a new connector?,3079,3084,moderator,none
2033_Julie_ Infection Control _Record No. UK-IC-01_AH_ W-TDI _UK_04102021 1415Hrs EST,A,190,"I think it boys down to feedback from self. It would mainly be feedback. It would mainly be feedback from stuff. And I guess if we're sort of doing an audit as well, if we're finding non compliant of that, then also we would then go in and find out why is this not happening? So it's to basically end up going back to assessing what the situation is at the lines and getting feedback from the people who are actually using them.",3088,3133,respondent,none
2033_Julie_ Infection Control _Record No. UK-IC-01_AH_ W-TDI _UK_04102021 1415Hrs EST,B,191,"Okay. So would that apply to a new connector if another competitor was trying to get their connector into your trust, how would you evaluate it?",3134,3146,moderator,none
2033_Julie_ Infection Control _Record No. UK-IC-01_AH_ W-TDI _UK_04102021 1415Hrs EST,A,192,"I think they would probably go off how they're selling it, the evidence that is there with that product, other people who use them. So from what I've experienced, some people are trying to bring your products in is basically the pitch that they sell to whoever it is that needs to give approval to the product being used. And if they happen to think if I want to give it a try, I'm sure cost comes into it as well. Then they would do a trial on it. And if they feel people happy with it, then the food fall it out.",3152,3195,respondent,other people
2033_Julie_ Infection Control _Record No. UK-IC-01_AH_ W-TDI _UK_04102021 1415Hrs EST,B,193,Alright.,3197,3198,moderator,none
2033_Julie_ Infection Control _Record No. UK-IC-01_AH_ W-TDI _UK_04102021 1415Hrs EST,A,194,Yeah.,3199,3200,respondent,none
2033_Julie_ Infection Control _Record No. UK-IC-01_AH_ W-TDI _UK_04102021 1415Hrs EST,B,195,Okay. Those are my questions. Any of the thoughts or comments about anything we have talked about.,3200,3206,moderator,none
2033_Julie_ Infection Control _Record No. UK-IC-01_AH_ W-TDI _UK_04102021 1415Hrs EST,A,196,"What was like, what is the purpose of this? A.",3212,3217,respondent,none
2033_Julie_ Infection Control _Record No. UK-IC-01_AH_ W-TDI _UK_04102021 1415Hrs EST,B,197,Project is to understand the various roles that the difference take holders play in the decision to use or not use needle free connections.,3222,3234,moderator,needle free connections
2033_Julie_ Infection Control _Record No. UK-IC-01_AH_ W-TDI _UK_04102021 1415Hrs EST,A,198,"Okay, so maybe this is just me being ignorant. Should I say I just automated? I don't know why I automatically thought everywhere is needle free, but I mean because I've done agency work as well. And I worked in different hospitals and it's been middle free be in London, outside London. So I wasn't aware that people still use a needle system.",3235,3266,respondent,none
2033_Julie_ Infection Control _Record No. UK-IC-01_AH_ W-TDI _UK_04102021 1415Hrs EST,B,199,"Well, not so much in the UK, but in other places. Yes.",3269,3275,moderator,none
2033_Julie_ Infection Control _Record No. UK-IC-01_AH_ W-TDI _UK_04102021 1415Hrs EST,A,200,Okay.,3275,3276,respondent,none
2033_Julie_ Infection Control _Record No. UK-IC-01_AH_ W-TDI _UK_04102021 1415Hrs EST,B,201,"But even so, this is just simply to make sure to what extent needle free connectors are being used. Who has influence in that decision? What are the factors that are important in deciding so it was useful. Very useful to talk to you from an infection control perspective.",3277,3298,moderator,infection control
2033_Julie_ Infection Control _Record No. UK-IC-01_AH_ W-TDI _UK_04102021 1415Hrs EST,A,202,"Yeah, I hope so. Anyway, I hope I didn't waffle while I was saying me.",3298,3305,respondent,none
2033_Julie_ Infection Control _Record No. UK-IC-01_AH_ W-TDI _UK_04102021 1415Hrs EST,B,203,It was fine. Thank you. I've enjoyed talking with you.,3306,3309,moderator,none
2033_Julie_ Infection Control _Record No. UK-IC-01_AH_ W-TDI _UK_04102021 1415Hrs EST,A,204,Thank you.,3309,3311,respondent,none
2033_Julie_ Infection Control _Record No. UK-IC-01_AH_ W-TDI _UK_04102021 1415Hrs EST,B,205,Alright. Have a good rest of your day. Be safe.,3312,3315,moderator,none
2033_Julie_ Infection Control _Record No. UK-IC-01_AH_ W-TDI _UK_04102021 1415Hrs EST,A,206,Thank you too.,3315,3317,respondent,none
2033_Julie_ Infection Control _Record No. UK-IC-01_AH_ W-TDI _UK_04102021 1415Hrs EST,B,207,Alright. Bye bye.,3317,3319,moderator,none
2033_Julie_ Infection Control _Record No. UK-IC-01_AH_ W-TDI _UK_04102021 1415Hrs EST,A,208,Bye.,3319,3319,respondent,none
